{
  "schemaVersion": 1,
  "id": "sqlite-baseline-reconciliation-v1",
  "status": "registry-frozen",
  "implementationClaim": false,
  "releaseGate": false,
  "productionThroughputClaim": false,
  "entryKinds": [
    "schema-envelope",
    "migration-lineage",
    "stream-head",
    "record-identity",
    "checkpoint-current",
    "checkpoint-revision",
    "lease-current",
    "used-lease-identity",
    "legal-hold",
    "migration-lock-current",
    "used-migration-lock-identity",
    "legacy-operation"
  ],
  "diagnosticEnvelope": {
    "fields": ["ruleId", "violationCount", "diagnosticsTruncated"],
    "defaultDiagnosticLimit": 16,
    "maximumDiagnosticLimit": 64,
    "tenantControlledValuesAllowed": false
  },
  "tempStorage": {
    "tempStore": "FILE",
    "defaultCacheKiB": 8192,
    "minimumCacheKiB": 1024,
    "maximumCacheKiB": 65536,
    "cacheSpill": true,
    "tempStoreDirectoryAllowed": false
  },
  "cursorSeal": {
    "protocolClaim": false,
    "emptyRootStatus": "deferred-cross-language-derivation",
    "rowDomain": "graph-engineering/sqlite-cursor-seal-row/v1\u0000",
    "chainDomain": "graph-engineering/sqlite-cursor-seal/v1\u0000",
    "sort": ["token-hash-utf8-bytes", "tenant-id-utf8-bytes"],
    "mutableRebindFields": ["providerDescriptorHash", "schemaIdentitySha256"],
    "immutableBlobDigests": ["requestScopeBlobSha256", "snapshotBlobSha256"],
    "immutableScalarFields": [
      "tenantId", "tokenHash", "kind", "principalHash", "authorizationHash",
      "streamId", "checkpointScope", "requestScopeByteLength", "pageSize",
      "nextPosition", "snapshotTailSequence", "snapshotTailRecordHash",
      "snapshotByteLength", "createdAtMs", "expiresAtMs", "consumedAtMs"
    ]
  },
  "rules": [
    { "ruleId": "BLR_TEMP_CONFIGURATION", "phase": "owner" },
    { "ruleId": "BLR_EXCLUSIVE_TRANSACTION_REQUIRED", "phase": "owner" },
    { "ruleId": "BLR_TRANSACTION_CHANGED", "phase": "owner" },
    { "ruleId": "BLR_UNEXPLAINED_WRITE", "phase": "owner" },
    { "ruleId": "BLR_STAGE_WRITE_COUNT", "phase": "stage" },
    { "ruleId": "BLR_STAGE_ITERATOR_INCOMPLETE", "phase": "stage" },
    { "ruleId": "BLR_STAGE_KEY_DUPLICATE", "phase": "stage" },
    { "ruleId": "BLR_STAGE_RELATION_MISSING", "phase": "stage" },
    { "ruleId": "BLR_STAGE_RELATION_EXTRA", "phase": "stage" },
    { "ruleId": "BLR_STAGE_KIND_RANK", "phase": "stage" },
    { "ruleId": "BLR_SCHEMA_CARDINALITY", "phase": "source" },
    { "ruleId": "BLR_LINEAGE_BINDING", "phase": "source" },
    { "ruleId": "BLR_CAPTURE_CLOCK", "phase": "source" },
    { "ruleId": "BLR_STAGE_COVERAGE", "phase": "stage" },
    { "ruleId": "BLR_STAGE_COUNT", "phase": "stage" },
    { "ruleId": "BLR_RECORD_STREAM_MISSING", "phase": "stream-record" },
    { "ruleId": "BLR_STREAM_EMPTY", "phase": "stream-record" },
    { "ruleId": "BLR_RECORD_GAP", "phase": "stream-record" },
    { "ruleId": "BLR_RECORD_PREDECESSOR", "phase": "stream-record" },
    { "ruleId": "BLR_STREAM_TAIL", "phase": "stream-record" },
    { "ruleId": "BLR_RECORD_HASH_DUPLICATE", "phase": "stream-record" },
    { "ruleId": "BLR_CHECKPOINT_REVISION_GAP", "phase": "checkpoint" },
    { "ruleId": "BLR_CHECKPOINT_RECORD_MISSING", "phase": "checkpoint" },
    { "ruleId": "BLR_CHECKPOINT_CURRENT_MISSING", "phase": "checkpoint" },
    { "ruleId": "BLR_CHECKPOINT_CURRENT_UNEXPECTED", "phase": "checkpoint" },
    { "ruleId": "BLR_CHECKPOINT_CURRENT_STALE", "phase": "checkpoint" },
    { "ruleId": "BLR_CHECKPOINT_CURRENT_BINDING", "phase": "checkpoint" },
    { "ruleId": "BLR_LEASE_STREAM_MISSING", "phase": "lease-lock-hold" },
    { "ruleId": "BLR_LEASE_HISTORY_INCOMPLETE", "phase": "lease-lock-hold" },
    { "ruleId": "BLR_LEASE_ACTIVE_BINDING", "phase": "lease-lock-hold" },
    { "ruleId": "BLR_MIGRATION_LOCK_HISTORY_INCOMPLETE", "phase": "lease-lock-hold" },
    { "ruleId": "BLR_MIGRATION_LOCK_ACTIVE_BINDING", "phase": "lease-lock-hold" },
    { "ruleId": "BLR_HOLD_STREAM_MISSING", "phase": "lease-lock-hold" },
    { "ruleId": "BLR_LEGACY_INVENTORY", "phase": "legacy" },
    { "ruleId": "BLR_LEGACY_APPEND_BINDING", "phase": "legacy" },
    { "ruleId": "BLR_LEGACY_CHECKPOINT_BINDING", "phase": "legacy" },
    { "ruleId": "BLR_LEGACY_LEASE_BINDING", "phase": "legacy" },
    { "ruleId": "BLR_LEGACY_LOCK_BINDING", "phase": "legacy" },
    { "ruleId": "BLR_CURSOR_AUTHORIZATION", "phase": "cursor" },
    { "ruleId": "BLR_CURSOR_SCOPE", "phase": "cursor" },
    { "ruleId": "BLR_CURSOR_BLOB_CANONICAL", "phase": "cursor" },
    { "ruleId": "BLR_CURSOR_POSITION", "phase": "cursor" },
    { "ruleId": "BLR_CURSOR_EXPIRY_CONSUMPTION", "phase": "cursor" },
    { "ruleId": "BLR_CURSOR_CATALOG_BINDING", "phase": "cursor" },
    { "ruleId": "BLR_CURSOR_SEAL_COUNT", "phase": "cursor" },
    { "ruleId": "BLR_CURSOR_SHAPE", "phase": "cursor" },
    { "ruleId": "BLR_CURSOR_EVENT_BINDING", "phase": "cursor" },
    { "ruleId": "BLR_CURSOR_CHECKPOINT_BINDING", "phase": "cursor" },
    { "ruleId": "BLR_CURSOR_REBIND_COUNT", "phase": "cursor" },
    { "ruleId": "BLR_CURSOR_SEAL_MISMATCH", "phase": "cursor" },
    { "ruleId": "BLR_PUBLISHED_STAGE_COVERAGE", "phase": "publication" },
    { "ruleId": "BLR_PUBLISHED_HEADER_BINDING", "phase": "publication" },
    { "ruleId": "BLR_PUBLISHED_SEQUENCE_BINDING", "phase": "publication" }
  ]
}
